{
  "schema_version": "1.6.0",
  "export_type": "browser_inclusive_development",
  "demo_version": "1.6.0",
  "generated_at": "2026-07-17T15:45:00Z",
  "contract": {
    "parity_status": "mapped_inclusive_development_contract",
    "compatible_repository_version": "0.7.0",
    "wealth_contract_version": "1.0.0",
    "human_development_contract_version": "1.0.0",
    "distribution_contract_version": "1.0.0",
    "composite_score_contract_version": "1.0.0",
    "inclusive_development_contract_version": "1.0.0"
  },
  "inputs": {
    "entity": "Example region",
    "start_year": 2025,
    "end_year": 2035,
    "population_start": 5,
    "population_end": 5.3,
    "produced_opening": 500,
    "produced_closing": 607,
    "human_opening": 400,
    "human_closing": 478,
    "natural_opening": 300,
    "natural_closing": 298,
    "produced_shadow_price": 1,
    "human_shadow_price": 1.2,
    "natural_shadow_price": 1.5,
    "gross_savings": 94,
    "depreciation": 25,
    "education_investment": 27,
    "health_investment": 16,
    "resource_depletion": 9,
    "pollution_damages": 4,
    "climate_damages": 6,
    "gni": 1220,
    "life_expectancy": 74,
    "expected_schooling": 14,
    "mean_schooling": 9.8,
    "income_per_capita": 19300,
    "social_floor": 25,
    "quintile_values": [
      18,
      31,
      45,
      63,
      98
    ],
    "component_weights": {
      "wealth_per_capita": 0.3,
      "adjusted_savings_rate": 0.25,
      "human_development": 0.25,
      "natural_share": 0.2
    }
  },
  "capital_accounts": {
    "produced": {
      "opening_value": 500,
      "closing_value": 607,
      "change": 107
    },
    "human": {
      "opening_value": 480,
      "closing_value": 573.6,
      "change": 93.6
    },
    "natural": {
      "opening_value": 450,
      "closing_value": 447,
      "change": -3
    }
  },
  "inclusive_wealth": {
    "opening": 1430,
    "closing": 1627.6,
    "change": 197.6,
    "per_capita_opening": 286,
    "per_capita_closing": 307.0943396226415,
    "produced_share": 0.37294175473089214,
    "human_share": 0.35242074219710007,
    "natural_share": 0.2746375030720079
  },
  "adjusted_net_savings": {
    "entity": "Example region",
    "time": 2035,
    "gross_savings": 94,
    "produced_capital_depreciation": 25,
    "education_investment": 27,
    "health_investment": 16,
    "human_capital_investment": 43,
    "natural_resource_depletion": 9,
    "pollution_damages": 4,
    "climate_damages": 6,
    "other_adjustments": 0,
    "total_deductions": 44,
    "adjusted_net_savings": 93,
    "gni": 1220,
    "adjusted_net_savings_percent_gni": 7.622950819672131,
    "sustainable_savings_signal": true,
    "unit": "currency_index",
    "schema_version": "1.0.0"
  },
  "human_development": {
    "entity": "Example region",
    "time": 2035,
    "life_expectancy": 74,
    "expected_schooling": 14,
    "mean_schooling": 9.8,
    "income_per_capita": 19300,
    "life_expectancy_index": 0.8307692307692308,
    "education_index": 0.7155555555555556,
    "income_index": 0.7949595155101181,
    "human_development_index": 0.7789141457589414,
    "schema_version": "1.0.0"
  },
  "distribution": {
    "schema_version": "1.0.0",
    "analysis_type": "distributional",
    "indicator": "household_resources",
    "unit": "resource_index",
    "entity": "Example region",
    "time": 2035,
    "higher_is_better": true,
    "summary": {
      "observations": 5,
      "total_weight": 1,
      "weighted_mean": 51.0,
      "weighted_median": 45,
      "p10": 18,
      "p40": 31,
      "p90": 98,
      "p90_p10_ratio": 5.444444444444445,
      "gini": 0.3011764705882354,
      "top_10_share": 0.3843137254901961,
      "bottom_40_share": 0.19215686274509805,
      "palma_ratio": 2.0,
      "social_floor": 25,
      "share_below_social_floor": 0.2
    },
    "group_summary": [
      {
        "group": "Quintile 1",
        "observations": 1,
        "weight": 0.2,
        "weighted_mean": 18,
        "resource_share": 0.07058823529411765,
        "population_share": 0.2
      },
      {
        "group": "Quintile 2",
        "observations": 1,
        "weight": 0.2,
        "weighted_mean": 31,
        "resource_share": 0.12156862745098039,
        "population_share": 0.2
      },
      {
        "group": "Quintile 3",
        "observations": 1,
        "weight": 0.2,
        "weighted_mean": 45,
        "resource_share": 0.17647058823529413,
        "population_share": 0.2
      },
      {
        "group": "Quintile 4",
        "observations": 1,
        "weight": 0.2,
        "weighted_mean": 63,
        "resource_share": 0.2470588235294118,
        "population_share": 0.2
      },
      {
        "group": "Quintile 5",
        "observations": 1,
        "weight": 0.2,
        "weighted_mean": 98,
        "resource_share": 0.3843137254901961,
        "population_share": 0.2
      }
    ],
    "records": [
      {
        "value": 18,
        "weight": 0.2,
        "group": "Quintile 1"
      },
      {
        "value": 31,
        "weight": 0.2,
        "group": "Quintile 2"
      },
      {
        "value": 45,
        "weight": 0.2,
        "group": "Quintile 3"
      },
      {
        "value": 63,
        "weight": 0.2,
        "group": "Quintile 4"
      },
      {
        "value": 98,
        "weight": 0.2,
        "group": "Quintile 5"
      }
    ],
    "meta": {
      "package_version": "0.7.0",
      "created_at": "2026-07-17T15:45:00Z"
    }
  },
  "intergenerational": {
    "start_per_capita": 286,
    "end_per_capita": 307.0943396226415,
    "change": 21.094339622641485,
    "non_declining_signal": true
  },
  "composite": {
    "definition": {
      "schema_version": "1.0.0",
      "id": "inclusive-development-score",
      "title": "Inclusive development score",
      "components": [
        {
          "component": "wealth_per_capita",
          "weight": 0.3,
          "direction": "higher",
          "lower_bound": 250,
          "upper_bound": 350
        },
        {
          "component": "adjusted_savings_rate",
          "weight": 0.25,
          "direction": "higher",
          "lower_bound": -5,
          "upper_bound": 15
        },
        {
          "component": "human_development",
          "weight": 0.25,
          "direction": "higher",
          "lower_bound": 0.55,
          "upper_bound": 0.9
        },
        {
          "component": "natural_share",
          "weight": 0.2,
          "direction": "higher",
          "lower_bound": 0.15,
          "upper_bound": 0.35
        }
      ],
      "missing_policy": "error",
      "meta": {
        "package_version": "0.7.0",
        "created_at": "2026-07-17T15:45:00Z",
        "normalization": "bounded_min_max",
        "score_range": [
          0,
          100
        ]
      }
    },
    "score": 61.72175112993635,
    "component_scores": [
      {
        "row_id": 3,
        "component": "wealth_per_capita",
        "raw_value": 307.0943396226415,
        "normalized_score": 0.5709433962264149,
        "weight": 0.3,
        "weighted_contribution": 17.128301886792446,
        "direction": "higher",
        "lower_bound": 250,
        "upper_bound": 350
      },
      {
        "row_id": 3,
        "component": "adjusted_savings_rate",
        "raw_value": 7.622950819672131,
        "normalized_score": 0.6311475409836065,
        "weight": 0.25,
        "weighted_contribution": 15.778688524590162,
        "direction": "higher",
        "lower_bound": -5,
        "upper_bound": 15
      },
      {
        "row_id": 3,
        "component": "human_development",
        "raw_value": 0.7789141457589414,
        "normalized_score": 0.654040416454118,
        "weight": 0.25,
        "weighted_contribution": 16.351010411352952,
        "direction": "higher",
        "lower_bound": 0.55,
        "upper_bound": 0.9
      },
      {
        "row_id": 3,
        "component": "natural_share",
        "raw_value": 0.2746375030720079,
        "normalized_score": 0.6231875153600396,
        "weight": 0.2,
        "weighted_contribution": 12.463750307200792,
        "direction": "higher",
        "lower_bound": 0.15,
        "upper_bound": 0.35
      }
    ],
    "weight_sensitivity": [
      {
        "component": "wealth_per_capita",
        "perturbation": "decrease",
        "original_weight": 0.3,
        "perturbed_weight": 0.24,
        "mean_absolute_score_change": 1.2,
        "max_absolute_score_change": 2.1,
        "min_score": 56.78877393150501,
        "max_score": 62.72175112993635
      },
      {
        "component": "wealth_per_capita",
        "perturbation": "increase",
        "original_weight": 0.3,
        "perturbed_weight": 0.36,
        "mean_absolute_score_change": 1.1,
        "max_absolute_score_change": 2.0,
        "min_score": 57.888773931505014,
        "max_score": 63.72175112993635
      },
      {
        "component": "adjusted_savings_rate",
        "perturbation": "decrease",
        "original_weight": 0.25,
        "perturbed_weight": 0.2,
        "mean_absolute_score_change": 1.2,
        "max_absolute_score_change": 2.1,
        "min_score": 56.78877393150501,
        "max_score": 62.72175112993635
      },
      {
        "component": "adjusted_savings_rate",
        "perturbation": "increase",
        "original_weight": 0.25,
        "perturbed_weight": 0.3,
        "mean_absolute_score_change": 1.1,
        "max_absolute_score_change": 2.0,
        "min_score": 57.888773931505014,
        "max_score": 63.72175112993635
      },
      {
        "component": "human_development",
        "perturbation": "decrease",
        "original_weight": 0.25,
        "perturbed_weight": 0.2,
        "mean_absolute_score_change": 1.2,
        "max_absolute_score_change": 2.1,
        "min_score": 56.78877393150501,
        "max_score": 62.72175112993635
      },
      {
        "component": "human_development",
        "perturbation": "increase",
        "original_weight": 0.25,